Grapheme	IPA	Examples	Languages	Frequence	Codepoints
^ɕ	ɕ	ɕe²¹, ɕi⁵⁵	LaowuNisu, CChajiang, SMangdi, WDutian, Xuzhang, EDiaocao, Ghomozo, Pholaypg, CQingyun, Alo, SouthernMujiymc, SNisu, Yangliu, Nasu, LopeAwuChen2010, ETaoshu, KopoGepo, CLeba, Phuzaypz, WYilu, Limi, Nise, Eka, HaniQiepu, Kazhuo, HaniLongwei, CLongjie, LuowuNisu, CQingsheng, EHoushan, LawuXinpingShuitangJiuha, ELolo, NNisu, CWachang, NuosuHuangDai1992, Mongi, Haoni, Talu, WShanglizhuo, LopeAwuYYFC1983, Nipu, CEYongan, Nesu, CLolo, Narsu, Neshu, Axi, SEGaoping, LuquanLisu, WShuizhuping, Lavu, Nersu	100	U+005e U+0255
^g	g	go²¹, go³³	Xuzhang, ETaoshu, SEGaoping, CLeba, Limi, Eka, Yangliu, EDiaocao, CChajiang, CEYongan, SMangdi, CLongjie, WShuizhuping, ELolo, WShanglizhuo, Talu, KopoGepo, Nipu, Nesu, WYilu, Narsu, CLolo, Lisu, Nise, CQingyun, Lipo, CQingsheng, Lavu, WDutian, EHoushan, LopeAwuChen2010, NNisu, CWachang, Mongi, LopeAwuYYFC1983, SanniSanie, Toloza, Neshu, Sodi, Axi, JingguLimi, Alo, HaniLongwei, Naso, Azhe, Nasu, Nersu	100	U+005e U+0067
^tʰ	tʰ	tʰu⁵⁵, tʰu²¹	CQingsheng, Talu, LaowuNisu, Nesu, WYilu, Narsu, Neshu, Sodi, LuowuNisu, Lavu, LopeAwuChen2010, Xuzhang, Senza, ELolo, ETaoshu, Mongi, EDiaocao, KopoGepo, CChajiang, Ghomozo, CLeba, CEYongan, Limi, SanniSanie, Toloza, HaniQiepu, SEGaoping, JingguLimi, Yino, Naso, WShuizhuping, Lidim, Nersu, Noso, EHoushan, CWachang, WShanglizhuo, Sani, Nipu, Phuzaypz, Pholaypg, CLolo, HaniLuchun, Nise, Eka, CQingyun, Alo, AzhaazaPelkey2011, CLongjie, Kuansi, TengchongLisu, Nasu, Yangliu, WDutian	100	U+005e U+0074 U+02b0
¹³$	¹³	va¹³, ʑɛ³³n̩¹³	Mongi, Nersu, Nipu, SouthernMujiymc, Phuzaypz, Mondzi, LaowuNisu, HlephoPhowayhl, WYilu	100	U+00b9 U+00b3 U+0024
tʰ	tʰ	i³¹tʰa³³, ʑi²¹tʰo³³	SouthernMujiymc, Phuzaypz, HlephoPhowayhl, Limi, Nesu, Pholaypg, HaniQiepu, SEGaoping, SNisu, Lavu, Xuzhang, ETaoshu, CWachang, Mongi, EDiaocao, Talu, LaowuNisu, CChajiang, Neshu, Eka, CQingyun, CQingsheng, LopeAwuChen2010, Senza, WShanglizhuo, Nipu, CLeba, CEYongan, SanniSanie, Narsu, Nise, Sodi, Alo, JingguLimi, Yino, CLongjie, Kuansi, Yangliu, WShuizhuping, Lidim, Nasu, Nersu, Noso, WDutian, EHoushan	100	U+0074 U+02b0
ɪ	ɪ	sɪ³⁴sɪ³³, ʔɪ⁵⁵ȵi³³	JingguLimi, Neshu, Noso, Yino, Senza, Lidim, Sani, LopeAwuYYFC1983, Nersu, Sodi, Nise, KopoGepo, Azhe, Narsu	100	U+026a
i̱	i̠	zi̱⁵⁵, tʂʰi̱⁵⁵	SanniSanie, Nise, Alo, Nasu, KopoGepo, LopeAwuChen2010, Talu, Sodi, Lavu, Naso, Lidim, Senza, Narsu, Neshu, Yino, Lipo, Nesu, Toloza, Mongi	100	U+0069 U+0331
^ts	ts	tsi⁵⁵, tsa³³	Ghomozo, Kazhuo, CEYongan, Yangliu, EDiaocao, Narsu, Eka, Senza, Nesu, SMangdi, HaniQiepu, Yino, LuowuNisu, Lidim, EHoushan, LahuNa, ELolo, ETaoshu, NuosuHuangDai1992, Mongi, Sani, Sodi, CQingyun, Naso, Nasu, Noso, LopeAwuChen2010, LawuXinpingShuitangJiuha, NNisu, Talu, LaowuNisu, KopoGepo, Nipu, SanniSanie, HaniLuchun, Nise, Neshu, Alo, HaniLongwei, Kuansi, Lipo	100	U+005e U+0074 U+0073
a̱	a̠	va̱⁵⁵, va̱²¹	Naso, Yino, Senza, Nise, Nasu, Talu, Lavu, Alo, Narsu, LopeAwuChen2010, Lidim, HaniLuchun, Nesu, KopoGepo, SanniSanie, Sodi, Azhe, Mongi	100	U+0061 U+0331
^ʑ	ʑ	ʑi²¹, ʑi³³	LopeAwuChen2010, AzhaazaPelkey2011, Senza, NuosuHuangDai1992, LaowuNisu, KopoGepo, Narsu, Nise, Alo, Yino, SouthernMujiymc, Naso, Nasu, Lidim, Nersu, Noso, Mongi, Nipu, Nesu, Toloza, Sodi, SNisu, Lavu, Talu, Neshu, ELolo, YongshengLisu, LopeAwuYYFC1983, Mondzi, Pholaypg, CLolo, NosuXide, Axi, TengchongLisu	100	U+005e U+0291
^h	h	hɛ̠²¹, hɑ³³bɑ³³	Naso, Noso, ETaoshu, HlephoPhowayhl, CLongjie, Nipu, WYilu, Lisu, Nise, CQingyun, WShuizhuping, WDutian, Xuzhang, Senza, CWachang, NuosuHuangDai1992, Talu, Sani, CChajiang, Ghomozo, CLeba, CEYongan, WeixiLisu, Alo, Yino, LuowuNisu, CQingsheng, Nasu, Lidim, Lavu, Nersu, TengchongLisu, LopeAwuChen2010, ELolo, WShanglizhuo, Mongi, YongshengLisu, Maang, LopeAwuYYFC1983, Limi, Toloza, NosuXide, Sodi, SEGaoping, JingguLimi, Kuansi, Yangliu, EHoushan	100	U+005e U+0068
^ʂ	ʂ	ʂa³³, ʂɛ³³	NuosuHuangDai1992, WShanglizhuo, WYilu, Xuzhang, NNisu, CWachang, CLeba, Limi, CQingyun, JingguLimi, CLongjie, LuowuNisu, WShuizhuping, WDutian, Pholaypg, SanniSanie, Toloza, LopeAwuChen2010, Senza, KopoGepo, CLolo, NosuXide, Sodi, Yino, Lidim, Mongi, Talu, Sani, LopeAwuYYFC1983, Neshu, SEGaoping, Alo, Axi, Naso, SNisu, Nasu, Azhe, CQingsheng, Lavu, Nersu, EHoushan	100	U+005e U+0282
x	x	a⁵⁵xo⁵⁵, kʰo̠²¹xɨ²¹	Haoni, HaniQiepu, JingguLimi, HaniLongwei, HaniLuchun, Eka, NNisu, LaowuNisu, KopoGepo, Nipu, Phuzaypz, AzhaazaPelkey2011, SNisu, EDiaocao, WShanglizhuo, Nesu, Pholaypg, Limi, SanniSanie, Narsu, Toloza, Neshu, SMangdi, Naso, EHoushan, LahuNa, LopeAwuChen2010, ETaoshu, CWachang, Mongi, Sani, CChajiang, CLeba, CEYongan, WYilu, Lisu, Sodi, CQingyun, SEGaoping, Axi, CLongjie, Lipo, Yangliu, Azhe, WShuizhuping, Nersu, WDutian	100	U+0078
^ȵ	ȵ	ȵi²¹, ȵi³³	Noso, Alo, LuowuNisu, Nasu, LopeAwuChen2010, Nipu, Mongi, Talu, Phuzaypz, Narsu, HaniQiepu, HaniLongwei, Toloza, Naso, Lavu, Nersu, Senza, NuosuHuangDai1992, KopoGepo, Nesu, HlephoPhowayhl, Sodi, JingguLimi, Yino, AzhaazaPelkey2011, SNisu, Lidim, Haoni, LopeAwuYYFC1983, Pholaypg, Nise, Neshu, NosuXide, SouthernMujiymc	100	U+005e U+0235
o̱	o̠	lo̱²¹, lo̱⁵⁵	SanniSanie, Nasu, Sodi, Talu, Lavu, Toloza, Yino, Senza, Lidim, KopoGepo, Narsu, Naso, LopeAwuChen2010, LopeAwuYYFC1983, Nise, Nesu, Neshu, Lipo	100	U+006f U+0331
²²$	²²	kʰɯ²², lɯ²²	Yino, AzhaazaPelkey2011, Azhe, SouthernMujiymc, WDutian	100	U+00b2 U+00b2 U+0024
^ŋ	ŋ	ŋa̱³³, ŋo⁵⁵	Mongi, Nise, Nersu, Nasu, LopeAwuChen2010, Sani, Nipu, Alo, Kazhuo, SouthernMujiymc, Noso, LaowuNisu, KopoGepo, Lipo, LahuNa, ELolo, Talu, Maang, Mondzi, Pholaypg, Limi, Lisu, HaniQiepu, HaniLongwei, Naso, Lavu, Xuzhang, CWachang, ETaoshu, NuosuHuangDai1992, Haoni, LopeAwuYYFC1983, SanniSanie, CLolo, HaniLuchun, JingguLimi, LuquanLisu, LuowuNisu	100	U+005e U+014b
tsʰ	tsʰ	ɑ⁵⁵n̩²¹tsʰɑ⁵⁵, a⁵⁵tsʰɿ̠²¹	HaniQiepu, ETaoshu, SEGaoping, CEYongan, Yangliu, WShuizhuping, WDutian, EHoushan, Xuzhang, CWachang, WShanglizhuo, CChajiang, CLeba, CQingsheng, EDiaocao, WYilu, Limi, CLongjie, Talu, CQingyun, Kuansi, LawuXinpingShuitangJiuha, ELolo, LaowuNisu, HaniLuchun, Eka, LuowuNisu, SNisu, Lavu	100	U+0074 U+0073 U+02b0
i̠	i̠	a⁵⁵vi̠²¹pɔ̠²¹, ʔni̠²¹ ɲi³³	CQingsheng, Pholaypg, EHoushan, ELolo, Eka, ETaoshu, CEYongan, SMangdi, SEGaoping, Kuansi, Xuzhang, Haoni, CLolo, AzhaazaPelkey2011, HaniLuchun, LuowuNisu, CChajiang, SNisu, Azhe, NNisu, Axi, Lipo	100	U+0069 U+0320
ɛ˞	ɛ˞	hɛ˞⁵⁵pɛ˞⁴¹pɛ˞³¹, tɕɛ˞²⁴tɕɛ˞³³	Yangliu, WShanglizhuo, Xuzhang, EHoushan, LuowuNisu, Ghomozo, WDutian, ELolo, WShuizhuping, CEYongan, EDiaocao	100	U+025b U+02de
a̠	a̠	ɛ³³ka̠ʔ²¹mu²⁴ka̠ʔ²¹, a⁵⁵vɛ̠²¹pa̠²¹	CQingyun, CQingsheng, CWachang, CLeba, Eka, CLongjie, LawuXinpingShuitangJiuha, ELolo, CChajiang, Ghomozo, HaniLuchun, SMangdi, ETaoshu, CEYongan, AzhaazaPelkey2011, Kuansi, EHoushan, Xuzhang, CLolo, Lipo	100	U+0061 U+0320
v	v	a⁵⁵vɛ̠²¹, a⁵⁵vi̠²¹	SMangdi, Eka, WShanglizhuo, Xuzhang, CWachang, ETaoshu, CChajiang, CLeba, CEYongan, Limi, CQingyun, SEGaoping, Yangliu, CQingsheng, EHoushan, WYilu, JingguLimi, CLongjie, WShuizhuping, WDutian, Talu, Lavu, LahuNa, EDiaocao, NuosuHuangDai1992, YongshengLisu, LaowuNisu, HlephoPhowayhl, Toloza, Lisu, NosuXide, Sodi, HaniLongwei, SouthernMujiymc, LuowuNisu, SNisu, TengchongLisu	100	U+0076
ɕ	ɕ	kʰu̱²¹ɕi̱²¹, mu³³ɕe⁵⁵	ETaoshu, SEGaoping, CEYongan, Nesu, AzhaazaPelkey2011, Ghomozo, Narsu, Eka, EHoushan, CChajiang, Phuzaypz, Limi, Neshu, SouthernMujiymc, CLongjie, LopeAwuChen2010, NNisu, EDiaocao, WShanglizhuo, Sani, KopoGepo, CLeba, CLolo, JingguLimi, LawuXinpingShuitangJiuha, ELolo, CWachang, Haoni, LaowuNisu, Pholaypg, WYilu, Toloza, Nise, Sodi, CQingyun, Alo, LuquanLisu, LuowuNisu, SNisu, WShuizhuping, Yangliu, Nasu, CQingsheng, Lavu, Noso	100	U+0255
ɣ	ɣ	mu⁵⁵ɣɨ³³, tɕy²¹ɣɨ²⁴	WShanglizhuo, HaniLuchun, Pholaypg, WYilu, JingguLimi, EHoushan, Ghomozo, Eka, SMangdi, Xuzhang, ETaoshu, CWachang, CQingyun, HaniLongwei, CLongjie, WShuizhuping, WDutian, CChajiang, CLeba, CEYongan, Lisu, HaniQiepu, SEGaoping, AzhaazaPelkey2011, SouthernMujiymc, CQingsheng, LahuNa, LawuXinpingShuitangJiuha, EDiaocao, Haoni, Maang, Sani, Phuzaypz, WeixiLisu, HlephoPhowayhl, Kazhuo, Lavu, Nersu, TengchongLisu	100	U+0263
tɕ	tɕ	bɨ²¹tɕi²⁴tɕi²⁴, m̩³³tɕi³³	JingguLimi, Ghomozo, Eka, ETaoshu, LawuXinpingShuitangJiuha, Mongi, Haoni, WYilu, Limi, HaniLuchun, HaniQiepu, SEGaoping, NuosuHuangDai1992, LaowuNisu, CChajiang, Nipu, Nesu, Sodi, Kazhuo, CLongjie, LuowuNisu, WShuizhuping, EHoushan, Xuzhang, Senza, CWachang, EDiaocao, WShanglizhuo, KopoGepo, CLeba, CEYongan, Narsu, Neshu, SMangdi, Yino, HaniLongwei, Kuansi, Lipo, CQingsheng, Lidim, Nersu, Noso, WDutian	100	U+0074 U+0255
j	j	a⁵⁵jɛ̠³³, mjɛ⁵⁵tjɛ³³	HaniLuchun, EDiaocao, Eka, EHoushan, CQingyun, SMangdi, SouthernMujiymc, CLongjie, LawuXinpingShuitangJiuha, CLeba, Phuzaypz, Limi, ETaoshu, LaowuNisu, CEYongan, HaniLongwei, Kuansi, Yangliu, CWachang, Haoni, CChajiang, Ghomozo, WYilu, HaniQiepu, CQingsheng, Xuzhang, WShanglizhuo, Pholaypg, HlephoPhowayhl, SEGaoping, Kazhuo, Lipo	100	U+006a
^tɕ	tɕ	tɕi³³, tɕy²¹	Ghomozo, HaniQiepu, HaniLongwei, LopeAwuChen2010, LawuXinpingShuitangJiuha, EDiaocao, Nise, CChajiang, CLeba, Kazhuo, CLongjie, CQingsheng, Nersu, WDutian, ETaoshu, CWachang, LaowuNisu, Sani, Nipu, Nesu, WYilu, Narsu, Alo, LuowuNisu, Naso, WShuizhuping, Nasu, Yangliu, Xuzhang, Senza, WShanglizhuo, NuosuHuangDai1992, CEYongan, SanniSanie, Toloza, Neshu, Sodi, SMangdi, CQingyun, SEGaoping, JingguLimi, Yino, Lidim, EHoushan	100	U+005e U+0074 U+0255
u̱	u̠	kʰu̱²¹, lu̱³³bɤ²¹	Alo, Yino, Senza, Lidim, Nesu, KopoGepo, LopeAwuChen2010, Narsu, Nise, Naso, Neshu, Axi, Lavu, Talu, NosuXide, Lipo, Azhe	100	U+0075 U+0331
ʅ	ʅ	tʂʰʅ⁵⁵, ʂʅ³³ni³³	Limi, Xuzhang, NNisu, WShuizhuping, WShanglizhuo, WDutian, WYilu, LuowuNisu, CLeba, CQingyun, CLolo, CLongjie, SEGaoping, CWachang, JingguLimi, SNisu, CQingsheng, Lipo	100	U+0285
⁴²$	⁴²	i⁴²ȵi⁴², ja³³ka⁴²	Yino, EDiaocao, HaniQiepu, Ghomozo, HaniLongwei, Yangliu, EHoushan, ETaoshu, YongshengLisu, Eka, TengchongLisu, WeixiLisu	100	U+2074 U+00b2 U+0024
ȵ	ȵ	i²¹ȵi²¹, ʑi³³ȵi²¹	SouthernMujiymc, Naso, Pholaypg, Toloza, Sodi, Alo, JingguLimi, Nasu, NuosuHuangDai1992, Mongi, Talu, Narsu, Lavu, Nersu, LopeAwuChen2010, Senza, Nipu, Phuzaypz, Nesu, Neshu, Yino, LuowuNisu, Lidim, Noso, Haoni, HlephoPhowayhl, HaniQiepu, LuquanLisu	100	U+0235
²²	²²	pʰi⁴⁴nɛ²²kʰu²¹u²²tɛ³³kɯ³³ti²²kʰɯ²¹, ȵa²²nɯ³³	Yino, AzhaazaPelkey2011, HaniQiepu, Ghomozo, Azhe, WDutian, Lipo, Eka, WShuizhuping, CQingyun, WShanglizhuo	100	U+00b2 U+00b2
g	g	ngɯ³³, ʑi³³ga³³	ETaoshu, Xuzhang, Limi, Eka, SEGaoping, WDutian, CWachang, EDiaocao, Mongi, Sani, CLeba, HaniLuchun, Sodi, SMangdi, WShuizhuping, Lidim, EHoushan, Senza, ELolo, WShanglizhuo, Nipu, Nesu, SanniSanie, Lisu, Yino, HaniLongwei, CLongjie, Yangliu, CQingsheng, Noso, LopeAwuChen2010, Talu, Maang, CChajiang, Ghomozo, Mondzi, CEYongan, WYilu, CLolo, Nise, NosuXide, CQingyun, Naso, Lavu, Nersu	100	U+0067
ɪ̱	ɪ̠	ȵɪ̱⁵⁵ha³³dɪ̱³³kʰu̱⁵⁵, bɪ̱⁵⁵	Sodi, Neshu, Yino, KopoGepo, Senza, Lidim, Nise, Narsu, Nesu, Nasu, Alo	100	U+026a U+0331
^tʂʰ	ʈʂʰ	tʂʰi²¹, tʂʰu²¹	Lavu, Talu, Sani, SanniSanie, Nasu, Nersu, Mongi, WShanglizhuo, KopoGepo, CLeba, WYilu, Limi, Toloza, Neshu, CQingyun, Alo, JingguLimi, CLongjie, Naso, WShuizhuping, WDutian, LopeAwuChen2010, Xuzhang, Senza, CWachang, Nise, Sodi, Yino, LuowuNisu, SNisu, Lidim, CLolo, AzhaazaPelkey2011, CQingsheng	100	U+005e U+0074 U+0282 U+02b0
^i	i	i²¹ȵi²¹, in³³	SEGaoping, WShanglizhuo, HlephoPhowayhl, Eka, AzhaazaPelkey2011, CLongjie, EHoushan, ETaoshu, EDiaocao, Phuzaypz, Limi, SMangdi, Senza, NuosuHuangDai1992, Talu, CChajiang, WYilu, Sodi, CQingyun, Yino, CQingsheng, Lidim, Lavu, WShuizhuping, Yangliu, LahuNa, CWachang, CLeba, CEYongan	100	U+005e U+0069
o̠	o̠	kʰo̠²¹, a⁵⁵to̠²¹	CEYongan, CQingsheng, CChajiang, LuowuNisu, CWachang, CLongjie, CLeba, CQingyun, ELolo, HaniLuchun, NNisu, LawuXinpingShuitangJiuha, Kuansi, Eka, SNisu, SEGaoping, JingguLimi	100	U+006f U+0320
^ɑ	ɑ	ɑ⁵⁵n̩²¹tsʰɑ⁵⁵, ɑ⁵⁵to⁵⁵	CQingsheng, CChajiang, CLeba, CWachang, Lisu, LuquanLisu, Lavu, Pholaypg, YongshengLisu, WeixiLisu, TengchongLisu, LuowuNisu, NuosuHuangDai1992, Kazhuo, Toloza, WShanglizhuo, Talu	100	U+005e U+0251
^j	j	je³¹nɔ³³, ji³¹ŋ³²³	EDiaocao, SMangdi, Kazhuo, Haoni, Xuzhang, HaniLuchun, LuowuNisu, LawuXinpingShuitangJiuha, Limi, ETaoshu, ELolo, Ghomozo, HaniLongwei, Kuansi, Lipo, LaowuNisu, SEGaoping, Yangliu, CChajiang, CLeba, WYilu, CLolo, Eka, HaniQiepu, JingguLimi, WDutian	100	U+005e U+006a
^tʂ	ʈʂ	tʂi³³, tʂa³³pu³³	JingguLimi, Neshu, Limi, SanniSanie, Talu, KopoGepo, Sani, NuosuHuangDai1992, Alo, Naso, Lavu, Mongi, Toloza, Sodi, Axi, Lipo, Nasu, Senza, NNisu, Mondzi, CLolo, Yino, AzhaazaPelkey2011, LuowuNisu, Lidim, Nersu, LopeAwuChen2010, CLeba, SEGaoping, SNisu, Azhe, WDutian	100	U+005e U+0074 U+0282
ɛ̠	ɛ̠	hɛ̠²¹, a⁵⁵vɛ̠²¹pa̠²¹	CQingyun, CLongjie, CLeba, SMangdi, CWachang, Pholaypg, CChajiang, NNisu, CEYongan, AzhaazaPelkey2011, Ghomozo, ETaoshu, CLolo, LuowuNisu, CQingsheng, Eka, EHoushan	100	U+025b U+0320
tɕʰ	tɕʰ	mu³³tɕʰi̱²¹, a⁵⁵tɕʰi̠²¹	LawuXinpingShuitangJiuha, EDiaocao, Eka, SMangdi, LuowuNisu, Limi, HaniQiepu, SEGaoping, Nersu, ELolo, Nesu, ETaoshu, LaowuNisu, KopoGepo, CChajiang, Nipu, CLeba, CEYongan, Narsu, Neshu, Alo, JingguLimi, CLongjie, WShuizhuping, Nasu, Lavu, LopeAwuChen2010, Senza, CWachang, WShanglizhuo, Talu, Sani, Ghomozo, WYilu, SanniSanie, CLolo, Yino, SNisu, CQingsheng, Lidim, Noso, WDutian	100	U+0074 U+0255 U+02b0
ᴀ	ɑ̟	zᴀ²¹ni³³, pᴀ¹¹pᴀ¹¹ku³⁵ti³³ni³³	LahuNa, NNisu, SNisu	100	U+1d00
^dʑ	dʑ	dʑi²¹, dʑu²¹	HaniLuchun, CChajiang, CLeba, Lidim, Mongi, Limi, CWachang, NuosuHuangDai1992, EDiaocao, CQingyun, SEGaoping, LuowuNisu, SNisu, WShuizhuping, CQingsheng, LopeAwuChen2010, Senza, WShanglizhuo, Nipu, Nesu, WYilu, CLolo, Toloza, Nise, Eka, SMangdi, Yino, CLongjie, Lavu, EHoushan, Xuzhang, ELolo, ETaoshu, Talu, KopoGepo, SanniSanie, Sodi, Alo, Kuansi, Lipo, Nasu, Noso	100	U+005e U+0064 U+0291
³⁵$	³⁵	lɛ³¹pʰɛ³⁵, ʨʰɛ²¹py³⁵	Maang, Kazhuo, Lisu, LahuNa, CEYongan, TengchongLisu, Limi, AzhaazaPelkey2011, Ghomozo, SEGaoping, Haoni, YongshengLisu, WeixiLisu	100	U+00b3 U+2075 U+0024
h	h	ma³³ha³³, ɑ⁵⁵ŋ̩²¹hɑ⁵⁵	Xuzhang, Senza, NuosuHuangDai1992, Talu, Yino, CLongjie, Lidim, LopeAwuChen2010, ETaoshu, CChajiang, CLeba, CEYongan, WeixiLisu, Toloza, Lisu, Nise, CQingyun, CQingsheng, Noso, CWachang, YongshengLisu, Sani, LopeAwuYYFC1983, Nipu, WYilu, Kuansi, Yangliu, Lavu, Nersu, WDutian, ELolo, Mongi, WShanglizhuo, Limi, NosuXide, SEGaoping, Alo, LuquanLisu, LuowuNisu, Naso, TengchongLisu, WShuizhuping, Nasu, EHoushan	100	U+0068
_	_	ne³³tʂɔ³³ȵe⁵⁵ F3 6G, ʔa⁵⁵ ŋ̩²¹ ka⁵⁵ la⁵⁵ mu³³	Kuansi, JingguLimi, LaowuNisu, HaniLongwei, HaniLuchun, HaniQiepu	100	U+005f
^f	f	fv̩³³, fu³³	HaniQiepu, HaniLongwei, Haoni, CLongjie, CQingsheng, EHoushan, ETaoshu, CWachang, EDiaocao, Narsu, CQingyun, Xuzhang, NNisu, WShanglizhuo, LaowuNisu, CChajiang, Nesu, Limi, SanniSanie, Neshu, SEGaoping, Kazhuo, Naso, WShuizhuping, LahuNa, LopeAwuChen2010, LawuXinpingShuitangJiuha, ELolo, Mongi, Talu, Sani, LopeAwuYYFC1983, Nipu, CLeba, Phuzaypz, WYilu, CLolo, Toloza, Lisu, Nise, Eka, Sodi, Alo, JingguLimi, LuowuNisu, Kuansi, Lipo, Nasu, Yangliu, Lavu, Nersu, Noso, WDutian	100	U+005e U+0066
ʂ	ʂ	bu³³ʂɔ³³, a²¹m̩³³ʂu̱³³kʰu̱⁵⁵	Xuzhang, AzhaazaPelkey2011, Lidim, Senza, NuosuHuangDai1992, Yino, LuowuNisu, Limi, WDutian, EHoushan, CWachang, WShanglizhuo, SanniSanie, Neshu, CLongjie, WShuizhuping, Nasu, Lavu, NNisu, CLeba, Pholaypg, WYilu, Toloza, Nise, SEGaoping, Alo, JingguLimi, Naso, SNisu, Talu, CQingyun, Azhe, Nersu	100	U+0282
¹³	¹³	li¹³e¹³pɔ²¹, ʑe¹³pi¹³u¹³	LaowuNisu, Mongi, Phuzaypz, SouthernMujiymc, Nersu, Nipu, Mondzi, HlephoPhowayhl, AzhaazaPelkey2011	100	U+00b9 U+00b3
^ɬ	ɬ	ɬi³³, ɬo²¹bo²¹	Pholaypg, Sani, SouthernMujiymc, KopoGepo, HlephoPhowayhl, Alo, AzhaazaPelkey2011, SNisu, Azhe, Noso, LopeAwuChen2010, LopeAwuYYFC1983, LuowuNisu, Senza, NNisu, NuosuHuangDai1992, Mongi, Narsu, Nise, Neshu, Sodi, Yino, HaniLongwei, Naso, Nasu, Lidim, Nipu, Phuzaypz, Nesu, NosuXide, Axi, Nersu	100	U+005e U+026c
dʑ	dʑ	a⁵⁵dʑy⁵⁵, a³³dʑɪ³³	NuosuHuangDai1992, CQingyun, Senza, CWachang, CLeba, WYilu, Nise, Eka, Yino, LuowuNisu, Lidim, Nersu, WShanglizhuo, CChajiang, HaniLuchun, SEGaoping, Alo, CLongjie, SNisu, Nasu, Noso, Xuzhang, SMangdi, Naso, WShuizhuping, CQingsheng, LopeAwuChen2010, NNisu, ETaoshu, YongshengLisu, LaowuNisu, KopoGepo, Nipu, Nesu, Narsu, Neshu, Sodi, LuquanLisu, WDutian	100	U+0064 U+0291
ʑ	ʑ	ɬi⁵⁵ʑi̠ɛ̠³³khu̠²¹, a⁵⁵mu³³sa̱⁵⁵ʑi³³	AzhaazaPelkey2011, SouthernMujiymc, Pholaypg, JingguLimi, NNisu, Lavu, Nersu, LaowuNisu, Alo, Mongi, Narsu, Toloza, Nise, Nasu, LopeAwuChen2010, NuosuHuangDai1992, KopoGepo, Nipu, Nesu, Neshu, SEGaoping, Naso, Senza, ELolo, YongshengLisu, CChajiang, Phuzaypz, HlephoPhowayhl, SanniSanie, CLolo, Axi, Yino, SNisu, Lidim, Noso	100	U+0291
ɬ	ɬ	ma̱⁵⁵ɬo̱²¹, a²¹ɬu²¹	SouthernMujiymc, Senza, NuosuHuangDai1992, Sani, Nise, Yino, Lidim, Sodi, HaniLongwei, KopoGepo, LuowuNisu, Noso, NNisu, Phuzaypz, HlephoPhowayhl, NosuXide, Naso, Nesu, Narsu, Neshu, Alo, AzhaazaPelkey2011, Nasu, LopeAwuChen2010, LopeAwuYYFC1983, Nipu, Pholaypg, Axi, SNisu, Azhe, Nersu	100	U+026c
⁵³	⁵³	lᴀ⁵³qhᴀ⁵³pə³³, ŋɔ⁵³ɕa⁵³n̩⁵³	LahuNa, Mongi, Kazhuo, WShanglizhuo, WYilu, Eka, Yangliu, CChajiang, Toloza, Mondzi, CQingsheng, Haoni, WDutian	100	U+2075 U+00b3
^dʐ	ɖʐ	dʐo̠²¹, dʐʅ²⁴	Toloza, SanniSanie, Limi, CLongjie, WYilu, Neshu, WDutian, Xuzhang, NNisu, CWachang, Talu, CLeba, WShuizhuping, Lavu, LopeAwuChen2010, WShanglizhuo, KopoGepo, LopeAwuYYFC1983, Phuzaypz, Nise, Sodi, CQingyun, SEGaoping, Alo, Axi, Naso, SNisu, CQingsheng, Nasu, Nersu, EHoushan, Senza, NuosuHuangDai1992, Sani, CLolo, NosuXide, Yino, LuowuNisu, Lidim	100	U+005e U+0064 U+0290
e̱	e̠	me̱²¹, ne̱²¹	Nesu, SanniSanie, Toloza, Naso, Axi, Nasu, Alo, KopoGepo, HaniLuchun	100	U+0065 U+0331
^ʔ	ʔ	ʔɪ⁵⁵ȵi³³, ʔɲiŋ³³	Kuansi, CQingyun, CLongjie, JingguLimi, NNisu, SNisu, Maang, EHoushan, HlephoPhowayhl, Xuzhang, CEYongan, CWachang	100	U+005e U+0294
u̠	u̠	ɬi⁵⁵ʑi̠ɛ̠³³khu̠²¹, a⁵⁵mu̠²¹	NNisu, HaniLuchun, ETaoshu, NuosuHuangDai1992, SNisu, Ghomozo, Eka, ELolo, CLolo, LuowuNisu, EDiaocao, LopeAwuYYFC1983, Pholaypg, AzhaazaPelkey2011, Kuansi, Xuzhang, SMangdi, Lipo, Azhe	100	U+0075 U+0320
n̩	n̩	ɑ⁵⁵n̩²¹tsʰɑ⁵⁵, a⁵⁵n̩²¹ti⁵⁵	Mongi, CQingyun, CEYongan, EHoushan, HlephoPhowayhl, CChajiang, SEGaoping, CQingsheng, CLongjie, Sani, Kuansi, EDiaocao, CLeba, WYilu, Nise, CWachang, WShanglizhuo, SanniSanie, ETaoshu, Phuzaypz, SouthernMujiymc	100	U+006e U+0329
ei	ei	mei²¹, mei²⁴	EDiaocao, Yangliu, LaowuNisu, LopeAwuYYFC1983, Maang, WShuizhuping, LahuNa, Ghomozo, Mondzi, CEYongan, SMangdi, WYilu, EHoushan, LopeAwuChen2010, CChajiang, CLongjie, CWachang, WDutian	100	U+0065 U+0069
³⁵	³⁵	tsɿ³⁵li³⁵koa³⁵la³⁵, sɿ³⁵ŋ³⁵tha³³	LahuNa, Xuzhang, Kazhuo, WDutian, Lisu, Eka, Maang, JingguLimi, SEGaoping, Limi, EHoushan, Ghomozo, YongshengLisu, CEYongan, WShanglizhuo, WeixiLisu	100	U+00b3 U+2075
tʂ	ʈʂ	a⁵⁵tʂa̠²¹, pɨ⁵⁵tʂʅ̠²¹	JingguLimi, LopeAwuChen2010, CWachang, Limi, CQingyun, CLongjie, WShuizhuping, NNisu, WShanglizhuo, Talu, Sani, KopoGepo, Phuzaypz, WDutian, Xuzhang, CLeba, WYilu, Toloza, Neshu, Sodi, Alo, AzhaazaPelkey2011, LuowuNisu, Naso, Lavu, Senza, NuosuHuangDai1992, Mondzi, SanniSanie, Nise, Yino, Lipo, Nasu, Yangliu, Lidim, Nersu	100	U+0074 U+0282
⁴⁵³$	⁴⁵³	no⁴⁵³, a³³ve⁴⁴pa⁴⁵³	WShuizhuping, Xuzhang, WYilu, Yangliu, WDutian	100	U+2074 U+2075 U+00b3 U+0024
w	w	nu⁵⁵wu²¹ɲɛ̠³³, no⁵⁵wu²¹ɲɛ̠³³	CLeba, CEYongan, Xuzhang, WDutian, SMangdi, CLongjie, CQingsheng, CWachang, WShanglizhuo, Phuzaypz, CQingyun, Yangliu, ETaoshu, EDiaocao, CChajiang, WShuizhuping, SEGaoping, WYilu, Kazhuo, Ghomozo, SouthernMujiymc, Kuansi, EHoushan	100	U+0077
iɛ̠	iɛ̠	liɛ̠²¹pʰiɛ̠³³, pʰiɛ̠²¹	CLeba, CWachang, CEYongan, CQingyun, NNisu, Ghomozo, CQingsheng	100	U+0069 U+025b U+0320
^n̩	n̩	n̩²¹dy⁵⁵, n̩³³	CLeba, WShuizhuping, Yangliu, CWachang, WShanglizhuo, WYilu, Xuzhang, Sani, SMangdi, CLongjie, HlephoPhowayhl, CQingyun, CQingsheng, ETaoshu, CEYongan, EDiaocao, CChajiang, Nise, KopoGepo, SanniSanie, Eka, HaniQiepu, HaniLongwei, Kuansi	100	U+005e U+006e U+0329
iɛ	iɛ	a⁵⁵miɛ³¹, miɛ³³xiɛ³³	NNisu, WYilu, Lipo, LaowuNisu, CEYongan, Lisu, Ghomozo, Kazhuo, EDiaocao, SEGaoping, LuowuNisu, Yangliu, CLeba, TengchongLisu, YongshengLisu, Pholaypg, WDutian, WeixiLisu	100	U+0069 U+025b
ʔ	ʔ	ɛ³³ka̠ʔ²¹mu²⁴ka̠ʔ²¹, kʰoʔ⁵³	Ghomozo, Eka, WYilu, WShuizhuping, SMangdi, CQingyun, WDutian, Xuzhang, Kuansi, CLongjie, HlephoPhowayhl, JingguLimi	100	U+0294
ɿ̠	ɿ̠	sɿ̠³³dzɿ⁵⁵, n̩²¹tsʰɿ̠³³	NNisu, CChajiang, Kuansi, CQingsheng, CQingyun, NuosuHuangDai1992, CWachang, CLeba, CLongjie, CEYongan, Haoni, Ghomozo, ETaoshu, NosuXide, EHoushan, HaniLuchun, Kazhuo, LopeAwuYYFC1983	100	U+027f U+0320
^ʐ	ʐ	ʐi³³, ʐo̠²¹ma³³	JingguLimi, SanniSanie, Sani, WShanglizhuo, Phuzaypz, CWachang, CQingyun, CLongjie, WShuizhuping, Xuzhang, Senza, Mongi, CLeba, SEGaoping, Yino, Lidim, NuosuHuangDai1992, Mondzi, Pholaypg, WYilu, AzhaazaPelkey2011, WDutian, NNisu, Maang, KopoGepo, Limi, Toloza, Neshu, NosuXide, Sodi, Axi, Yangliu, Azhe, CQingsheng	100	U+005e U+0290
^o	o	o⁵⁵po³³, o²¹	Limi, Eka, Nasu, HaniQiepu, ELolo, Lisu, Sani, Kazhuo, HaniLongwei, NuosuHuangDai1992, HaniLuchun, Toloza, Sodi, Senza, Nipu, SEGaoping, Yino, WShuizhuping, Lidim, LahuNa, Talu, Haoni, KopoGepo, WeixiLisu, NosuXide, SMangdi, Axi, LuquanLisu, LuowuNisu, Kuansi, Naso, Yangliu, Lavu, Noso	100	U+005e U+006f
³⁴$	³⁴	ʐu²⁴ɣɨ³⁴, pʰv̩³⁴	HaniQiepu, NuosuHuangDai1992, WYilu, CEYongan, WDutian, Senza, WShuizhuping, WShanglizhuo, Xuzhang, Limi, Ghomozo, SEGaoping	100	U+00b3 U+2074 U+0024
ɤ̪	ɤ̪	lɤ̪²¹, kʰɤ̪⁵⁵dɤ̪²¹	EDiaocao, ETaoshu, WShanglizhuo, EHoushan, Yangliu, Xuzhang, Ghomozo	100	U+0264 U+032a
^m̩	m̩	m̩²¹, m̩³³ȵi²¹mo²¹	Senza, Yino, Lidim, Sani, Sodi, SanniSanie, KopoGepo, Phuzaypz, WDutian, Nise, HaniLongwei, ETaoshu, HlephoPhowayhl, Kazhuo, SouthernMujiymc, Xuzhang, CWachang, NuosuHuangDai1992, CChajiang, WShuizhuping, Yangliu	100	U+005e U+006d U+0329
^tsh	tsh	tshɿ³¹, tshɿ³³	Kazhuo, HaniLuchun, HaniLongwei, Haoni, NuosuHuangDai1992, LahuNa, Lisu, NNisu, LopeAwuChen2010, Ghomozo, Nise	100	U+005e U+0074 U+0073 U+0068
m̩	m̩	a⁵⁵m̩²¹ba̠²¹, mo³³m̩³³	HaniLongwei, Yangliu, ETaoshu, CChajiang, WDutian, Senza, Yino, Lidim, SouthernMujiymc, CQingsheng, LopeAwuChen2010, KopoGepo, EHoushan, WShanglizhuo, Sani, CEYongan, HlephoPhowayhl, Limi, Nise, Sodi, HaniQiepu, CWachang, NuosuHuangDai1992, YongshengLisu, CLeba, Neshu, CQingyun, SMangdi, SEGaoping, CLongjie, WShuizhuping	100	U+006d U+0329
⁴²	⁴²	i⁴²ȵi⁴², a⁴²ndi⁴²hi²²	Yino, EDiaocao, EHoushan, Ghomozo, Yangliu, HaniQiepu, Eka, CLongjie	100	U+2074 U+00b2
ai	ai	a⁵⁵kai²¹, a⁵⁵qai²¹	Yangliu, WShanglizhuo, Xuzhang, Eka, CQingyun, SMangdi, Maang, Ghomozo, WYilu, LaowuNisu, Limi, LawuXinpingShuitangJiuha, CWachang, WShuizhuping, EHoushan, CLongjie, EDiaocao, SEGaoping	100	U+0061 U+0069
⁵⁴$	⁵⁴	ɕi⁵⁴, sɿ⁵⁴	Noso, LahuNa, Ghomozo, WDutian	100	U+2075 U+2074 U+0024
^ɛ	ɛ	ɛ³³ka̠ʔ²¹mu²⁴ka̠ʔ²¹, ɛ³³ɣə¹³	Eka, SouthernMujiymc, Phuzaypz, HlephoPhowayhl, WShuizhuping, Narsu, WDutian, AzhaazaPelkey2011, SanniSanie, Xuzhang, CLongjie, Nise, Yangliu, SMangdi, Noso, EHoushan	100	U+005e U+025b
^w	w	wu²¹, wu²¹tɕʰi⁵⁵	Kazhuo, CEYongan, CChajiang, Ghomozo, Phuzaypz, CLeba, WYilu, CQingyun, SEGaoping, WShuizhuping, CWachang, WShanglizhuo, Limi, SMangdi, CLongjie, Yangliu, Xuzhang, CQingsheng, LawuXinpingShuitangJiuha, LaowuNisu, ETaoshu, EDiaocao, HaniLongwei, SNisu, TengchongLisu, EHoushan	100	U+005e U+0077
ɲ	ɲ	a³³ɲi²¹, ɨ⁵⁵ɲi³³	Limi, Xuzhang, CQingyun, Ghomozo, CLongjie, CLeba, CEYongan, Kuansi, Lisu, CWachang, Lipo, HaniLuchun, Yangliu, CLolo	100	U+0272
ɔ̠	ɔ̠	a⁵⁵vi̠²¹pɔ̠²¹, nɔ̠⁴⁵nɔ̠⁴⁵	Pholaypg, EHoushan, AzhaazaPelkey2011, ETaoshu, Ghomozo, HaniLuchun, JingguLimi	100	U+0254 U+0320
ɚ	ə˞	su²¹vɚ³³, gɯ²¹bɚ³³	Neshu, SanniSanie, Nasu, Alo, Naso, LopeAwuYYFC1983	100	U+025a
^u	u	u³³, u⁵⁵pa̠²¹	Alo, Haoni, LuowuNisu, CQingsheng, Pholaypg, CChajiang, Kuansi, Talu, Limi, HaniLuchun, SEGaoping, HaniLongwei, Mongi, SMangdi, Lavu, LahuNa, LawuXinpingShuitangJiuha, EDiaocao, WYilu, CLolo, Nasu, ETaoshu, LaowuNisu, Mondzi, CLeba, Narsu, Toloza, CLongjie, Nersu, WDutian	100	U+005e U+0075
^ph	pʰ	phu³³, phu⁴⁴	LahuNa, HaniLongwei, HaniLuchun, Haoni, Lisu, Kazhuo, Mondzi, NNisu, Maang, NuosuHuangDai1992, LopeAwuYYFC1983, Ghomozo, NosuXide, Azhe	100	U+005e U+0070 U+0068
ĩ	ĩ	ĩ³³ɲĩ³³, n̩²¹ti⁵⁵ĩ³³	ETaoshu, Xuzhang, Yangliu, WYilu, CLongjie, Eka, CLeba, CWachang, WDutian, Limi, CEYongan, LawuXinpingShuitangJiuha, Kuansi, Haoni, WeixiLisu, EHoushan	100	U+0129
